{
  "schema_version": "1.0.0",
  "record_type": "supervisor_review_context_pack",
  "id": "self-healing-candidate-review-coverage-gap-senolytics-review-landscape-repair-taxonomy-mapping",
  "pack_type": "candidate_review_lane",
  "created_at": "2026-06-28T17:58:29Z",
  "purpose": "Bounded supervisor review for coverage-gap-senolytics-review-landscape-repair lane taxonomy_mapping.",
  "scope": {
    "question": "candidate_review: Required review lane is missing: taxonomy_mapping.",
    "hallmark_ids": [
      "cellular_senescence"
    ],
    "track_ids": [
      "senolytics"
    ],
    "intervention_ids": []
  },
  "target_candidate": {
    "candidate_change_id": "coverage-gap-senolytics-review-landscape-repair",
    "path": "data/candidate-changes/coverage-gap-senolytics-review-landscape-repair.json",
    "lifecycle_status": "submitted",
    "summary": "Updates the senolytics coverage assessment and records a blocked no-op search/screening trail to keep the recent systematic-review/meta-analysis landscape gap explicit after a bounded extraction-refresh pass could not add a source-snapshot-backed review source. The repair is partial: no recent systematic review or meta-analysis was screened into the knowledge base because the job supplied no source row or context pack and PubMed snapshot retrieval was unavailable from the worker.",
    "required_review_lanes": [
      "extraction_fidelity",
      "synthesis_boundary",
      "taxonomy_mapping"
    ],
    "proposed_record_count": 5,
    "proposed_records": [
      {
        "record_type": "candidate_change",
        "record_id": "coverage-gap-senolytics-review-landscape-repair",
        "path": "data/candidate-changes/coverage-gap-senolytics-review-landscape-repair.json",
        "change_type": "create",
        "rationale": "Tracks the bounded self-healing repair candidate and required review-lane contract."
      },
      {
        "record_type": "coverage_assessment",
        "record_id": "senolytics-coverage-repair-2026-06-21",
        "path": "data/coverage-assessments/senolytics-coverage-repair-2026-06-21.json",
        "change_type": "update",
        "rationale": "Refreshes the review-landscape category and gap text to preserve the unresolved systematic-review/meta-analysis screening gap and record the source-row/snapshot blocker."
      },
      {
        "record_type": "research_session",
        "record_id": "2026-06-28-senolytics-review-landscape-repair",
        "path": "research/sessions/2026-06-28-senolytics-review-landscape-repair.json",
        "change_type": "create",
        "rationale": "Records the bounded extraction-refresh session and blocked outcome for the review-landscape gap."
      },
      {
        "record_type": "search_log",
        "record_id": "search-2026-06-28-senolytics-review-landscape",
        "path": "research/search-logs/2026-06-28-senolytics-review-landscape.json",
        "change_type": "create",
        "rationale": "Records the attempted PubMed review-landscape query and the worker-network blocker."
      },
      {
        "record_type": "screening_run",
        "record_id": "screening-2026-06-28-senolytics-review-landscape",
        "path": "research/screening-runs/2026-06-28-senolytics-review-landscape.json",
        "change_type": "create",
        "rationale": "Records that no search hits could be screened into the knowledge base during this bounded pass."
      }
    ]
  },
  "review_lane": "taxonomy_mapping",
  "review_context": {
    "active_review_records": [],
    "complete_accepting_review_lanes": [],
    "missing_review_lanes": [
      "extraction_fidelity",
      "synthesis_boundary",
      "taxonomy_mapping"
    ],
    "open_major_or_critical_review_ids": [],
    "lane_acceptance_criteria": [
      "Review only the target candidate and the single review lane named by review_lane.",
      "Use verdict accept only when the lane is complete, non-blocking, and has no open major or critical findings.",
      "Use needs_revision or reject when the proposed records fail this lane's source, extraction, taxonomy, synthesis, or safety boundary.",
      "When the lane is acceptable, include a passed quality_checks[] entry named supervisor_review_lanes in the final agent_run.",
      "When outputs.proposed_records[] matches the repair candidate ledger, include a passed quality_checks[] entry named candidate_agent_run_ledger_match in the final agent_run."
    ],
    "relevant_input_records": [
      {
        "record_type": "candidate_change",
        "record_id": "coverage-gap-senolytics-review-landscape-repair",
        "path": "data/candidate-changes/coverage-gap-senolytics-review-landscape-repair.json",
        "role": "target_candidate"
      },
      {
        "record_type": "coverage_assessment",
        "record_id": "senolytics-coverage-repair-2026-06-21",
        "path": "data/coverage-assessments/senolytics-coverage-repair-2026-06-21.json",
        "role": "proposed_record"
      },
      {
        "record_type": "screening_run",
        "record_id": "screening-2026-06-28-senolytics-review-landscape",
        "path": "research/screening-runs/2026-06-28-senolytics-review-landscape.json",
        "role": "proposed_record"
      },
      {
        "record_type": "search_log",
        "record_id": "search-2026-06-28-senolytics-review-landscape",
        "path": "research/search-logs/2026-06-28-senolytics-review-landscape.json",
        "role": "proposed_record"
      },
      {
        "record_type": "research_session",
        "record_id": "2026-06-28-senolytics-review-landscape-repair",
        "path": "research/sessions/2026-06-28-senolytics-review-landscape-repair.json",
        "role": "proposed_record"
      }
    ]
  },
  "schema_context": {
    "schema_paths": [
      "schemas/agent-run.codex-output.schema.json",
      "schemas/agent-run.schema.json",
      "schemas/evidence-review.schema.json",
      "schemas/candidate-change.schema.json"
    ],
    "required_fields": [
      "agent_run.outputs.candidate_change_id",
      "agent_run.outputs.proposed_records[]",
      "agent_run.outputs.generated_files[]",
      "agent_run.quality_checks[]",
      "candidate_change.proposed_records[]",
      "candidate_change.required_review_lanes[] equals expected_outputs.required_review_lanes[]",
      "evidence_review.review_lane",
      "evidence_review.verdict",
      "evidence_review.findings[]"
    ],
    "known_schema_limitations": [
      "codex_job.expected_outputs records expected file paths, while this context pack additionally names the evidence_review_id for the lane."
    ]
  },
  "expected_outputs": {
    "candidate_change_id": "candidate-review-coverage-gap-senolytics-review-landscape-repair-taxonomy-mapping-repair",
    "evidence_review_id": "coverage-gap-senolytics-review-landscape-repair-taxonomy-mapping",
    "proposed_record_paths": [
      "data/candidate-changes/candidate-review-coverage-gap-senolytics-review-landscape-repair-taxonomy-mapping-repair.json",
      "data/evidence-reviews/coverage-gap-senolytics-review-landscape-repair-taxonomy-mapping.json"
    ],
    "generated_file_paths": [
      "data/candidate-changes/candidate-review-coverage-gap-senolytics-review-landscape-repair-taxonomy-mapping-repair.json",
      "data/evidence-reviews/coverage-gap-senolytics-review-landscape-repair-taxonomy-mapping.json"
    ],
    "export_paths": [],
    "required_review_lanes": [
      "taxonomy_mapping"
    ]
  },
  "verification": {
    "worker_commands": [
      "npm run validate:records",
      "npm run audit:references",
      "npm run audit:agent-schemas",
      "npm run audit:agentic-process"
    ],
    "coordinator_post_run": [
      "npm run export:triage-state",
      "npm run reconcile:parallel",
      "npm run metrics:orchestration",
      "npm run export:release-readiness",
      "npm run export:latest",
      "npm run verify:knowledge-base"
    ]
  },
  "constraints": [
    "Create only the repair candidate and evidence_review paths declared in expected_outputs.",
    "Set the repair candidate required_review_lanes[] exactly to expected_outputs.required_review_lanes[].",
    "Do not promote, apply, or directly mutate the target candidate during a lane review.",
    "Do not add open-ended human-judgment escape hatches; make an agentic supervisor verdict from the available records.",
    "Inspect additional files only when the pack points to them or validation reveals a pack inconsistency.",
    "Do not perform broad repository searches or full-record dumps for pack-backed reviews; query only the specific ids and paths required by this pack."
  ],
  "known_limitations": [
    "The pack is a compact routing contract, not a replacement for inspecting the target candidate's proposed records.",
    "Prior review state is summarized from evidence_review_ids already attached to the target candidate."
  ]
}
